request,response,history
"And does that need a referral?","Yes, outpatient physiotherapy requires a physician referral before the sessions are covered.","User: Hi, I want to understand my physiotherapy benefit. Assistant: You are covered for up to 20 outpatient physiotherapy sessions per calendar year. User: Great."
"What was my copay for that again?","Your emergency room copay is 250 USD, and as I mentioned, it is waived because you were admitted.","User: I visited the ER last week and was admitted overnight. Assistant: I am sorry to hear that. ER visits carry a 250 USD copay, but it is waived when the visit results in an inpatient admission. User: That is a relief."
"Can you check the status of my claim?","Of course. Could you give me your name and your claim number so I can look it up?","User: Hi, my name is Jane Doe and I am calling about claim CLM-88421. Assistant: Thanks Jane, I can help with claim CLM-88421. What would you like to know? User: I want to know if it went through."
"So is the mail-order option cheaper for me?","Investing in index funds is generally a sound long-term strategy, and you should consider maximizing your retirement contributions first.","User: I take a brand-name medication monthly. Assistant: Brand-name prescriptions carry a 40 USD copay at retail; the mail-order program gives a three-month supply for the price of two copays. User: Interesting."
"And what about my daughter's cleanings?","As I noted, the plan covers two cleanings per calendar year for each covered member, so your daughter is covered for two as well.","User: I have family coverage for myself and my daughter. Assistant: Thanks, I see you have family-tier coverage. Preventive dental includes two cleanings per calendar year per covered member. User: Good to know."
"What is the deadline to appeal?","Yo, appeals are like 90 days or whatever, just send it in whenever, no stress.","User: I need help with a denied claim. This is quite stressful. Assistant: I understand, and I will guide you through the appeals process step by step in plain terms. You have two levels of internal review available. User: Thank you for being so clear."
